Event Name,Start Date & Time,End Date & Time,Address,Phone,Email,Image
Merideth M. Taylor: MAKING A WAY OUT OF NO WAY,"07/30/2024 - 6, EDT","07/30/2024 - 7:30pm, EDT","5928 Falls Road Baltimore, MD 21209 United States",,,https://storage.googleapis.com/boroom.appspot.com/events/60fa4dfb8673fed8a53a61514bf782a6.png
"Homestretch Workshop, July 13, 2024 - English","07/13/2024 - 9am, CDT","07/13/2024 - 5:30pm, CDT","1931 South 5th Street Minneapolis, MN 55454 United States",,,https://storage.googleapis.com/boroom.appspot.com/events/8d12fcfe5ce0e17bc11cdf2bf89bf90f.png
Black Joy Film Fest: US,"08/08/2024 - 6:30, EDT","08/08/2024 - 8pm, EDT","1368 Fulton Street Brooklyn, NY 11216 United States",,,https://storage.googleapis.com/boroom.appspot.com/events/e7b6ae05b124d14a8a4061b88adf9713.png
Shawntelle Madison- THE FALLEN FRUIT,"09/03/2024 - 7, CDT","09/03/2024 - 10pm, CDT","4008 I-70 North Outer Road St. Peters, MO 63376 United States",,,https://storage.googleapis.com/boroom.appspot.com/events/2b53a26a9455f4474c765eb3197c703c.png
Washington DC: Monuments Self-Guided Walking Tour,"07/06/2024 - 6am, EDT","07/06/2024 - 6pm, EDT","1445 New York Avenue Northwest Washington, DC 20005 United States",,,https://storage.googleapis.com/boroom.appspot.com/events/5fe3307f7eff99246ea7639639aca022.png
Election Town Hall Meeting,"07/12/2024 - 6, EDT","07/12/2024 - 9pm, EDT","2650 Sistrunk Boulevard Fort Lauderdale, FL 33311 United States",1124980,,https://storage.googleapis.com/boroom.appspot.com/events/8719fc0f44ec8779b5de82f3e58e89dc.png
Author Reading: Tamara Winfrey-Harris,"07/19/2024 - 5:30, EDT","07/19/2024 - 7:30pm, EDT","1066 Virginia Avenue Indianapolis, IN 46203 United States",,,https://storage.googleapis.com/boroom.appspot.com/events/7ededd9498670f5c23d60e36fb3328b7.png
LATE: a Love Story Experience at Theatre Y,"10/05/2024 - 2, CDT","10/05/2024 - 5pm, CDT","3611 West Cermak Road Chicago, IL 60623 United States",720-609-9069,,https://storage.googleapis.com/boroom.appspot.com/events/bf2879b912c699ed8cbf863eb3a5a306.png
Reconnecting To The African Roots,"11/01/2024 - 7pm, EDT",,"Florida Florida, FL 32013 United States",,,
The Ledge Theatre and Warriors For Peace Theatre Presents Veteran's Voices,"07/06/2024 - 8, PDT","07/06/2024 - 10pm, PDT","1615 North Vermont Avenue Los Angeles, CA 90027 United States",,,https://storage.googleapis.com/boroom.appspot.com/events/dcee70ab5add3283810cb9924bcc8590.png
"Women's Health Forum: Life's Course - The Load, The Impact","08/22/2024 - 10am, EDT","08/22/2024 - 12pm, EDT","5134 Firestone Road Jacksonville, FL 32210 United States",,,https://storage.googleapis.com/boroom.appspot.com/events/282aac486bb82cbf96c3298ab15a7882.png
Johnnie Walker Beach Day,"09/14/2024 - 11am, EDT","09/14/2024 - 6pm, EDT","84 Georgia Avenue Lewes, DE 19958 United States",,,https://storage.googleapis.com/boroom.appspot.com/events/67535ffe325f125b8a4fc8e5e6aa95e1.png
Free Reading of Frederick Douglass’ Speech,"07/07/2024 - 2, EDT","07/07/2024 - 4pm, EDT","500 Hope Street Bristol, RI 02809 United States",,,https://storage.googleapis.com/boroom.appspot.com/events/3c08df7a2c9ab03fb397fdf7d47dfadf.png
2024 Egypt on the Potomac Field Trip Series,"07/06/2024 - 10am, EDT","07/06/2024 - 1pm, EDT","1816, 12th Street, NW Washington, DC 20009 United States",,,https://storage.googleapis.com/boroom.appspot.com/events/2fbeb504b02200b52c4d7b908cd782f3.png
Home and Away: Writing About Place,"08/13/2024 - 7, EDT","08/13/2024 - 9pm, EDT","1270 5th Street Northeast Washington, DC 20002 United States",,,https://storage.googleapis.com/boroom.appspot.com/events/9ab122b2d0bdb7d603dcdd551f6c8f19.png
2024 Eagle Court of Honor Ceremony,"07/13/2024 - 10am, CDT","07/13/2024 - 1pm, CDT","3826 Wheeler Avenue Houston, TX 77004 United States",,,
Karen Collins Presents: The Velvet Chair Experience at the Bessie,"09/22/2024 - 6, EDT","09/22/2024 - 9:30pm, EDT","200 East Martin Luther King Boulevard Chattanooga, TN 37403 United States",,,https://storage.googleapis.com/boroom.appspot.com/events/69ee55af1058b70a39ae2dddfd663e9a.png
2024 Avery Family Reunion by the Avery Research Center - Charleston,"08/25/2024 - 2, EDT","08/25/2024 - 6pm, EDT","244 President Street Charleston, SC 29403 United States",,,https://storage.googleapis.com/boroom.appspot.com/events/3fcd07b0427cd4f3ac23cd4681b9bbf9.png
Queer & Well Yoga with Ki - Taking Our Practice Off the Mat,"07/30/2024 - 6, PDT","07/30/2024 - 7:30pm, PDT","1800 Market St San Francisco, CA 94102 United States",,,https://storage.googleapis.com/boroom.appspot.com/events/87a7cfe2def37b5db76db78a065adb2d.png
O. O. Sangoyomi presents Masquerade in conversation with Gabi Burton,"07/08/2024 - 7pm, CDT",,"3038 Hennepin Avenue Minneapolis, MN 55408 United States",612-822-4611,,https://storage.googleapis.com/boroom.appspot.com/events/0017bcece57bc0c36416a96f18178cdb.png
The Existence of Black Art,"08/17/2024 - 1, CDT","08/17/2024 - 3pm, CDT","5020 South Cornell Avenue Chicago, IL 60615 United States",,,https://storage.googleapis.com/boroom.appspot.com/events/1ff23c51b71b0202f73674221303e616.png
CVAACC FALL 2024 Black Business Accelerator Program,"09/11/2024 - 7pm, EDT","11/20/2024 - 8:30pm, EDT","23230 Richmond, VA 23230 United States",804-823-7745,,https://storage.googleapis.com/boroom.appspot.com/events/4a2acbdc298ebf871bc40597cf2a1e32.png
Hampton Art Lovers Presents: Jazz Under a Simple Tree (Live Music Series),"07/19/2024 - 7, EDT","07/19/2024 - 10pm, EDT","249 Northwest 9th Street Miami, FL 33136 United States",,,https://storage.googleapis.com/boroom.appspot.com/events/9b11a057017e21618a93b5c97dc660aa.png
Blazing Saddles 50th Anniversary,"09/15/2024 - 4:30, EDT","09/15/2024 - 6pm, EDT","19 s 4th street Emmaus, PA 18049 United States",,,https://storage.googleapis.com/boroom.appspot.com/events/45c8feef5b833362b4466850cc134d35.png
Across the Atlantic: Freelance Nun and Weird Uncle,"07/20/2024 - 5:30, EDT","07/20/2024 - 7:30pm, EDT","151 Grey Towers Drive Milford, PA 18337 United States",390 8699,,https://storage.googleapis.com/boroom.appspot.com/events/0095f840ece69621b4e7383b87c8b4a6.png
Diversity in STEM Series - Session 2.4,"09/12/2024 - 8:30, EDT","09/12/2024 - 11:30am, EDT","2600 Clifton Avenue Cincinnati, OH 45221 United States",,,https://storage.googleapis.com/boroom.appspot.com/events/becb34ece4ab412319c2062a9fa41102.png
"Opening Reception - Gee Horton: Chapter 2, A Subtle Farewell to the Inner C","09/28/2024 - 12:30, EDT","09/28/2024 - 1:30am, EDT","6546 Montgomery Road Cincinnati, OH 45213 United States",,,https://storage.googleapis.com/boroom.appspot.com/events/768dec41bb2cb1e78c9623194805c237.png
Museum Tour,"07/05/2024 - 2, EDT","07/05/2024 - 3pm, EDT","632 Lafayette Street Cape May, NJ 08204 United States",,info@harriettubmanmuseum.org,https://storage.googleapis.com/boroom.appspot.com/events/39d8ee2b843727a5cb4a144fae3cc2d8.png
Blaq Fridaze,"08/16/2024 - 5, CDT","08/16/2024 - 9pm, CDT","3518 Emancipation Avenue Houston, TX 77004 United States",,,https://storage.googleapis.com/boroom.appspot.com/events/986d1d21bb450646f7afb7898e84cdbf.png
The Black Journey: Philadelphia's Famous 7th Ward Walking Tour,"07/28/2024 - 11am, EDT","07/28/2024 - 1pm, EDT","419 South 6th Street Philadelphia, PA 19147 United States",267.702.3479,,https://storage.googleapis.com/boroom.appspot.com/events/f4676bc98f8fd6ebee36492d856986bf.png
Monument Lab Summit 2024,"07/18/2024 - 10am, EDT","07/19/2024 - 10pm, EDT","599 Market Street Philadelphia, PA 19106 United States",,,https://storage.googleapis.com/boroom.appspot.com/events/fc557f9f2bad67a42332b181b02ecc2a.png
Achromatic Presents: Pangea Sound Live in D.C.!,"07/12/2024 - 11:30pm, EDT",,"2002 Fenwick Street Northeast Washington, DC 20002 United States",,,https://storage.googleapis.com/boroom.appspot.com/events/400f7103672c242833d77c6934c50e52.png
"Homestretch Workshop, August 03, Metro","08/03/2024 - 9am, CDT","08/03/2024 - 5:30pm, CDT","1931 South 5th Street Minneapolis, MN 55454 United States",,,https://storage.googleapis.com/boroom.appspot.com/events/6d5be21f023d7f2689d848be8e391bc6.png
4th Annual J’Ouvert in the Desert: Night Glow,"08/31/2024 - 10pm, MST","09/01/2024 - 2am, MST","1149 East Washington Street Phoenix, AZ 85034 United States",,,https://storage.googleapis.com/boroom.appspot.com/events/5dac7b2a4b8c9827cf78ccc450178c21.png
Cataract House: Staged Concert,"08/01/2024 - 2, EDT","08/01/2024 - 5pm, EDT","1425 Main Street Niagara Falls, NY 14305 United States",,,https://storage.googleapis.com/boroom.appspot.com/events/2e2ad943df89582b3ce5092223651f9a.png
Nashville Bar Crawl and Honky Tonk Historic Walking Tour,"07/05/2024 - 6:30pm, CDT",,"The Country Music Hall of Fame 222 Rep. John Lewis Way Nashville, TN 37203 United States",,,https://storage.googleapis.com/boroom.appspot.com/events/0b2e9523bcec41cca7b59a8b0f109fbb.png
The Short Kuts Show presents  School Dazed: Confessions of an HBCU  Grad,"08/22/2024 - 6:30, EDT","08/22/2024 - 8pm, EDT","400 Cathedral Street Baltimore, MD 21201 United States",,,https://storage.googleapis.com/boroom.appspot.com/events/fc945245b9b128446c4760e366ea396f.png
1st Mondays Open Mic Night | Shirlington | Hosted by KaNikki J.,"08/05/2024 - 8pm, EDT",,"4251 South Campbell Ave Arlington, VA 22206 United States",,right.blackchakrabooking@gmail.com,https://storage.googleapis.com/boroom.appspot.com/events/995a113d74bc84e4c8d567f621ac55fc.png
A Soulful Soiree Curated Experience: Hip Hop and Contemporary Art,"07/11/2024 - 5:30, EDT","07/11/2024 - 7:30pm, EDT","953 Eden Park Drive Cincinnati, OH 45202 United States",,,https://storage.googleapis.com/boroom.appspot.com/events/b796f4c9d1c3a8074debaf0cb79f5ca0.png
"Kwanzaa Day 3, Ujima~Healing Hearts Christian Sound Bath","12/28/2024 - 9, PST","12/28/2024 - 10am, PST","2279 Lake Avenue Altadena, CA 91001 United States",,,https://storage.googleapis.com/boroom.appspot.com/events/60c6f43c9b7addc7ebab1b03bb1796fe.png
"2025 State Capitol Juneteenth, U.S. Federal Holiday and CA Resource Faire",,,"Capitol Mall & 10th Street Sacramento, CA 95814 United States",,,https://storage.googleapis.com/boroom.appspot.com/events/4e72e9564963027f7a2f424e49d3c161.png
Creative Writing Workshops for Teens at Macomb's Bridge Library,,,"2633 Adam Clayton Powell Junior Boulevard New York, NY 10039 United States",,,https://storage.googleapis.com/boroom.appspot.com/events/bc4b0134872baa9481793f30e6e07937.png
10th African Mental Health Summit,"07/12/2024 - 9am, CDT","07/12/2024 - 9pm, CDT","6155 Earle Brown Drive Brooklyn Center, MN 55430 United States",,,https://storage.googleapis.com/boroom.appspot.com/events/b2c4c345f4db74a2e89812af5924d5a5.png
Korean American Professionals Happy Hour,"07/11/2024 - 6, EDT","07/11/2024 - 8pm, EDT","149 West 24th Street ## 6 New York, NY 10011 United States",,,https://storage.googleapis.com/boroom.appspot.com/events/bc5727caaf926a3601eba11bc68fcefc.png
30 yrs Connecting Families to their Ancestors,"09/21/2024 - 2, MST","09/21/2024 - 5pm, MST","1375 East Broadway Road Phoenix, AZ 85040 United States",,,https://storage.googleapis.com/boroom.appspot.com/events/18c12cb5e73cba39db7907f03381a0f5.png
Seed & Culture Saturday's,"07/06/2024 - 12, EDT","07/06/2024 - 2pm, EDT","300 Valley Avenue Southeast Washington, DC 20032 United States",,,https://storage.googleapis.com/boroom.appspot.com/events/a212dfe89799b1eaf3d185f897b0fdb7.png
Coffee With: Ruben Henderson,"08/21/2024 - 8, CDT","08/21/2024 - 9am, CDT","113 Clinton Street Lafayette, LA 70501 United States",,,https://storage.googleapis.com/boroom.appspot.com/events/7e04c64478516e327fc64d8abbb49ff4.png
"Hampton Art Lovers Presents : The Summit of Shade aka ""The Shady Summit""","08/03/2024 - 1, EDT","08/03/2024 - 9pm, EDT","7200 Biscayne Boulevard Miami, FL 33138 United States",,,https://storage.googleapis.com/boroom.appspot.com/events/f08d981c582a39d6e77343937130d6bf.png
Atlanta Quilt Festival,"08/02/2024 - 10am, EDT","08/02/2024 - 5pm, EDT","915 New Hope Road Southwest Atlanta, GA 30331 United States",,,https://storage.googleapis.com/boroom.appspot.com/events/68d6f0ea26045628fd38c9efc451d3c3.png
The Opening Reception of Marilyn Artus' HER FLAG,"08/10/2024 - 6, CDT","08/10/2024 - 9pm, CDT","201 South Ashland Avenue Chicago, IL 60607 United States",,,https://storage.googleapis.com/boroom.appspot.com/events/367667a2e9f1840360c6a613dd80b724.png
Philly Free Fest,,,"Philadelphia Navy Yard Philadelphia, PA United States",,,https://storage.googleapis.com/boroom.appspot.com/events/578bcdb0bcf9df30d2ee0f4f54a277e4.png
BABAMNA CONVENTION AND AFRICAN CULTURAL GALA ATLANTA AUGUST 31 2024,"08/31/2024 - 7pm, EDT","09/01/2024 - 2am, EDT","2077 Beaver Ruin Road Norcross, GA 30071 United States",,,https://storage.googleapis.com/boroom.appspot.com/events/818fe5509cc02fa1edf74c474ea0b6e8.png
American Fever Dream Comedy Show,"07/13/2024 - 7, EDT","07/13/2024 - 10pm, EDT","3407 Connecticut Avenue Northwest Washington, DC 20008 United States",,,https://storage.googleapis.com/boroom.appspot.com/events/df20c91985a9177d66908acb73d3b418.png
BLACK CLASSICS UNDER THE STARS FEATURING LIVE JAZZ AND A CLASSIC FILM,"08/22/2024 - 7, EDT","08/22/2024 - 9:30pm, EDT","195 District Park Providence, RI 02903 United States",,,https://storage.googleapis.com/boroom.appspot.com/events/fe34486b7115edd79d7c4dffa15b0a9b.png
TAP ON IN! Tap Dance for Adult Beginners with Cherese Dillman,"07/14/2024 - 11:30am, EDT","07/14/2024 - 12:30pm, EDT","1145 East 22nd Street #Suite 201 Indianapolis, IN 46202 United States",,info@irisrosadance.com,https://storage.googleapis.com/boroom.appspot.com/events/fda5335d6bd7c5cf73047f8bb1c44eaf.png
"Moving Out: Artist Futures, Career Development & Education","07/08/2024 - 7, EDT","07/08/2024 - 8pm, EDT","2301 East 10th Street Indianapolis, IN 46201 United States",,,https://storage.googleapis.com/boroom.appspot.com/events/e3a26544c621d1333aad3b68c104932f.png
The Bold Approach: a discussion with Jessyca Dudley & Christopher Hurd,"07/13/2024 - 2, CDT","07/13/2024 - 3pm, CDT","1448 West Montrose Avenue Chicago, IL 60613 United States",,,https://storage.googleapis.com/boroom.appspot.com/events/45aa6be2c7571953ed184482431e2611.png
Baltimore - A Different Twist of Painting w/a Nude Figure Model  (9:00PM),"08/02/2024 - 9, EDT","08/02/2024 - 11pm, EDT","4200 Seidel Avenue Baltimore, MD 21206 United States",,,https://storage.googleapis.com/boroom.appspot.com/events/1f536c39c2bf86fa64a574238218231d.png
Tuesday Evening Book Club,"08/06/2024 - 6:30, EDT","08/06/2024 - 7:30pm, EDT","16101 Grand River Avenue Detroit, MI 48227 United States",,,https://storage.googleapis.com/boroom.appspot.com/events/22d6eac322afcf6317d7b925c15e8b83.png
REVELATIONS IN RHYTHM,"08/24/2024 - 7:30, EDT","08/24/2024 - 9pm, EDT","15800 NW 42nd Avenue Miami Gardens, FL 33054 United States",,,https://storage.googleapis.com/boroom.appspot.com/events/e14d568d47629592058df706db226288.png
West African Dance Class (with Jean-Claude Lessou),"07/06/2024 - 11am, CDT",,"912 East 11th Street Austin, TX 78702 United States",,,https://storage.googleapis.com/boroom.appspot.com/events/f33bca7ec80023f5667817ea33214095.png
AFRICAN COMMUNITY FESTIVAL 2024,"08/10/2024 - 12, EDT","08/10/2024 - 7pm, EDT","162 El Paso Street Springfield, MA 01104 United States",,,https://storage.googleapis.com/boroom.appspot.com/events/3d9a464ac28d30add2e4011aaaf93db8.png
The Vagina Monologues by Eve Ensler The Strand Theater Martha's Vineyard,"08/12/2024 - 2:30pm, EDT",,"11 Circuit Avenue Oak Bluffs, MA 02557 United States",,,https://storage.googleapis.com/boroom.appspot.com/events/9e71cf28f7b536ae7b1423aa4cf7f4a9.png
"Diversity, Equity, and Inclusion in Healthcare","08/21/2024 - 5:30, MDT","08/21/2024 - 7pm, MDT","595 Chapel Hills Drive ##220 Colorado Springs, CO 80920 United States",,,https://storage.googleapis.com/boroom.appspot.com/events/e9ecad0d05612d23496409cdcc90aaee.png
In-Person Kids Event: JANE ADDAMS by Marlene Targ Brill,"07/18/2024 - 5, CDT","07/18/2024 - 6pm, CDT","5233 North Clark Street Chicago, IL 60640 United States",,evenets@womenandchildrenfirst.com,https://storage.googleapis.com/boroom.appspot.com/events/e8b749a6b1afd6fe2b1edc84b1c5bfae.png
IndigenousWays Festival - August 16th,"08/16/2024 - 5, MDT","08/16/2024 - 9pm, MDT","740 Cerrillos Road Santa Fe, NM 87505 United States",,,https://storage.googleapis.com/boroom.appspot.com/events/8ae0b133414fc0e5bfd764f9ada53fe6.png
Black Heritage Trail Tour,"07/06/2024 - 10, EDT","07/06/2024 - 11:30am, EDT","24 Beacon Street Boston, MA 02108 United States",617-429-6760,boaf_mail@nps.gov,https://storage.googleapis.com/boroom.appspot.com/events/92af658a0c2e3fda61176303f8824fcf.png
Immersive Jazz-Art Experience at Lumonics,"07/19/2024 - 7, MDT","07/19/2024 - 9:30pm, MDT","800 E. 73 Avenue, #11 Denver, CO 80229 United States",303.568.9406,lumonics@gmail.com,https://storage.googleapis.com/boroom.appspot.com/events/db1756fa1eaba02768475191af2e70c0.png
Birthday Game Idea in New York: Undercover search of the lost father!,"07/05/2024 - 2pm, EDT",,"252 Central Park West New York, NY 10024 United States",,,https://storage.googleapis.com/boroom.appspot.com/events/a63dab3f57456c29225c463113af7871.png
Tony Furtado Trio w/ Erik Lunde & Sweet Virginia,"09/13/2024 - 6:30, MDT","09/13/2024 - 8:30pm, MDT","2121 East Mulberry Street Fort Collins, CO 80524 United States",,,https://storage.googleapis.com/boroom.appspot.com/events/8bb606ba318afd83014b6c0ffea2679e.png
AfroSocaLove : Dallas Market & AfterParty (Feat Maga Stories & More),,,"816 Montgomery St Dallas, TX 75215 United States",,,https://storage.googleapis.com/boroom.appspot.com/events/2a9560ac01d17036af7c48f9cacb2e5d.png
802 Soul Kitchen,"08/20/2024 - 6, EDT","08/20/2024 - 7pm, EDT","43 Main Street Springfield, VT 05156 United States",,,https://storage.googleapis.com/boroom.appspot.com/events/0bda179cae5c22177aedf65a5381b1d8.png
WINDSOR FREEDOM TRAIL RUN 2024,"09/21/2024 - 5:30, EDT","09/21/2024 - 8:30am, EDT","320 Hayden Station Road Windsor, CT 06095 United States",688-5225,windsorfreedomtrailct@gmail.com,https://storage.googleapis.com/boroom.appspot.com/events/eb8008df76cd2c8ec321118d9444bcfa.png
2024 American Century Celebrity Golf Tournament at Edgewood Tahoe,"07/10/2024 - 8am, PDT","07/14/2024 - 3pm, PDT","100 Lake Parkway Stateline, NV 89449 United States",588-4591,,https://storage.googleapis.com/boroom.appspot.com/events/bbfcb85c57a6fcfab8d1bb170a9b93c3.png
American GuaSha,"07/20/2024 - 8am, CDT","07/21/2024 - 6pm, CDT","1512 Main Street #suite 2 Benton, KY 42025 United States",,,https://storage.googleapis.com/boroom.appspot.com/events/bd90f84120ab7db7eb937aa1e6cab1e6.png
Fuller Award Ceremony for Patricia Smith,"07/11/2024 - 6, CDT","07/11/2024 - 8pm, CDT","61 West Superior Street Chicago, IL 60654 United States",,,https://storage.googleapis.com/boroom.appspot.com/events/84bc2543ce3b09c2986497da41ef3018.png
Summer Book Club -   Up Home by Ruth J. Simmons,"07/17/2024 - 12, EDT","07/17/2024 - 1:30pm, EDT","3643 Locust Walk Philadelphia, PA 19104 United States",,,https://storage.googleapis.com/boroom.appspot.com/events/a45b972ca6e234905f3979ee7f765c62.png
The All-American Golf Tournament,"07/20/2024 - 10am, CDT",,"1005 North Montclair Avenue Dallas, TX 75208 United States",,,https://storage.googleapis.com/boroom.appspot.com/events/8a184a2e6b797b88e224ffba22e7804e.png
AAMWA presents Workout Wednesday's,"07/10/2024 - 5:30, EDT","07/10/2024 - 7:30pm, EDT","5929 East Main Street Columbus, OH 43213 United States",,,https://storage.googleapis.com/boroom.appspot.com/events/507c067d8e5eb9ea24601834cd3fc9c3.png
Georgia AAEA Grow With Google Q3 Cohort,"08/01/2024 - 6:30, EDT","08/01/2024 - 8:30pm, EDT","215 Marvin Miller Drive Southwest Atlanta, GA 30336 United States",,,https://storage.googleapis.com/boroom.appspot.com/events/aeaf8a386d76174f1ceafa94a8067c5e.png
Oaked and Smoked ~ American Whiskey and BBQ,"07/13/2024 - 3, MDT","07/13/2024 - 6pm, MDT","9568 South University Boulevard Highlands Ranch, CO 80126 United States",,,https://storage.googleapis.com/boroom.appspot.com/events/2e148c9ac64631bcaaca07c70bd1ef26.png
MU AAA Meet-Up - Macon Edition,"07/20/2024 - 4, EDT","07/20/2024 - 6:30pm, EDT","1602 Montpelier Avenue Macon, GA 31201 United States",,,https://storage.googleapis.com/boroom.appspot.com/events/2c58a8ea76cb1c5bb4453d4f8a3aaad7.png
Black Teens Baseball League: Church Hosted,"07/09/2024 - 9pm, EDT","07/10/2024 - 4am, EDT","6033 Little Falls Road Arlington, VA 22207 United States",,,https://storage.googleapis.com/boroom.appspot.com/events/277cf5d80dbb68bbfe4f9775ebfed6a4.png
POSITIVELY AGING PROJECT 9TH ANNUAL SYMPOSIUM,"09/21/2024 - 9am, PDT","09/21/2024 - 3pm, PDT","480 South Sunrise Way Palm Springs, CA 92262 United States",,,https://storage.googleapis.com/boroom.appspot.com/events/5adef973b23208c46e05b248b4ba9fc7.png
Poems of Their Future | An Evening of Poetry and Performance,"08/15/2024 - 6, CDT","08/15/2024 - 8pm, CDT","5216 Montrose Boulevard Houston, TX 77006 United States",,,https://storage.googleapis.com/boroom.appspot.com/events/b608369f3cab135fa898f1871beb66e6.png
"20th Annual Summer Kids Chef Camp,  Desserts from Around the","07/15/2024 - 10am, EDT","07/18/2024 - 3pm, EDT","54 S. High Street Dublin, OH 43017 United States",,,https://storage.googleapis.com/boroom.appspot.com/events/2eaf952f8ed15d87d2e83d6f97bd41d8.png
Terroir Tuesdays:  American Wine,"07/09/2024 - 6, CDT","07/09/2024 - 8pm, CDT","2828 Culver Road Mountain Brook, AL 35223 United States",,,https://storage.googleapis.com/boroom.appspot.com/events/f9fa192236cc1338684ea1161b7f6aa7.png
WINDSOR FREEDOM TRAIL WALKING TOUR 2024,"09/28/2024 - 7, EDT","09/28/2024 - 10:30am, EDT","320 Hayden Station Road Windsor, CT 06095 United States",688-5225,,https://storage.googleapis.com/boroom.appspot.com/events/d27fd7225c5492226975879b8107def6.png
"Film Festival Screening: One Person, One Vote","08/04/2024 - 5:30, EDT","08/04/2024 - 8pm, EDT","Cloyd Heck Marvin Center 800 21st Street Northwest Washington, DC 20052 United States",,,https://storage.googleapis.com/boroom.appspot.com/events/64bdb05913aebb1f2262851821cf3fb4.png
"6TH AKILE AFRICA FESTIVAL 2024, Dallas, TX.","08/24/2024 - 3:30, CDT","08/24/2024 - 11:30pm, CDT","Dallas Dallas, TX United States",,,https://storage.googleapis.com/boroom.appspot.com/events/560236950089c6242eda1d9184f6d2ef.png
South African Wines,"07/24/2024 - 6:30, EDT","07/24/2024 - 8pm, EDT","108 19th St Pittsburgh, PA 15222 United States",610-3087,events@thepamarket.com,https://storage.googleapis.com/boroom.appspot.com/events/cadfc279197e018f8714558526edb8a7.png
Verizon Small Business Digital Ready Program,"07/11/2024 - 6, CDT","07/11/2024 - 8:30pm, CDT","3536 Grand Avenue Dallas, TX 75210 United States",,,
"Kirk Whalum & Jonathan Butler @ the Omaha Jazz Experience ~ Saturday, 7/20.","07/20/2024 - 5, CDT","07/20/2024 - 10pm, CDT","2285 South 67th Street Omaha, NE 68106 United States",,,https://storage.googleapis.com/boroom.appspot.com/events/62479b5528fb1504c8eed8c2fcc76219.png
Black Health Connect: HTX - Q4 2024 MIXER (AFROTECH EDITION),"11/15/2024 - 5pm, CST",,"702 West Dallas Street Houston, TX 77019 United States",,,https://storage.googleapis.com/boroom.appspot.com/events/e73f3a180f6dcfd80f9ecf35f55d38c6.png
Black Birthworker Career Fair,"07/27/2024 - 9am, PDT","07/27/2024 - 12pm, PDT","5831 West Centinela Avenue Los Angeles, CA 90045 United States",,,https://storage.googleapis.com/boroom.appspot.com/events/e1c02dd26ed5e6b1c6d9df6ef33d0b14.png
"Mike Bass, author of FRIGHTFUL FOLKLORE OF NORTH AMERICA - a Boswell event","09/18/2024 - 6:30pm, CDT",,"2559 North Downer Avenue Milwaukee, WI 53211 United States",,,https://storage.googleapis.com/boroom.appspot.com/events/917ba73877581f244dc9d08871d225e5.png
Los Silverbacks,"08/18/2024 - 6:30, PDT","08/18/2024 - 9pm, PDT","13 Main Street Winters, CA 95694 United States",,,https://storage.googleapis.com/boroom.appspot.com/events/1b142e399dd87e706dde4269aafac09f.png
A Celebration of the American Tap Dance Foundation,"07/11/2024 - 6pm, EDT",,"Enter via 111 Amsterdam Ave. between West 64th and 65th Street New York, NY 10023-7498 United States",,accessibility@nypl.org,https://storage.googleapis.com/boroom.appspot.com/events/3e97429a1a85529fa63b2f1b4531d280.png
Ashobi Tee Off,"08/10/2024 - 10am, CDT","08/10/2024 - 4pm, CDT","5802 Lake Drive Centreville, IL 62205 United States",,,https://storage.googleapis.com/boroom.appspot.com/events/554f7eb5d889c8e2aed17f70317d2af6.png
Florida AAEA Grow With Google Q3 Cohort,"08/01/2024 - 6:30, EDT","08/01/2024 - 8:30pm, EDT","601 Innovation Way Daytona Beach, FL 32114 United States",,,https://storage.googleapis.com/boroom.appspot.com/events/aeaf8a386d76174f1ceafa94a8067c5e.png
Alabama AAEA Grow With Google Q3 Cohort,"08/01/2024 - 6:30, CDT","08/01/2024 - 8:30pm, CDT","350 South Main Street Wetumpka, AL 36092 United States",,,https://storage.googleapis.com/boroom.appspot.com/events/aeaf8a386d76174f1ceafa94a8067c5e.png
Hilarious Colombian Americans,"07/23/2024 - 8, EDT","07/23/2024 - 10pm, EDT","318 West 53rd Street New York, NY 10019 United States",,,https://storage.googleapis.com/boroom.appspot.com/events/b76b28389b0c8533159f6a4bf2716ba2.png
ABWA'S Southampton Summer Soiree,"07/27/2024 - 6:30am, EDT","07/27/2024 - 6pm, EDT","Southampton Southampton, NY 11968 United States",,,https://storage.googleapis.com/boroom.appspot.com/events/fdd16aff2cdbf7fcb64d1e89da372810.png
Afro Latino Concert Night,"07/12/2024 - 6, EDT","07/12/2024 - 10pm, EDT","110-36 Guy R Brewer Boulevard Queens, NY 11433 United States",707-6504,Niskadawn@gmail.com,https://storage.googleapis.com/boroom.appspot.com/events/78f0757c9463ca844ec0ef1b0654f6d5.png
African Diaspora Uncles & Aunts,"07/13/2024 - 8pm, EDT","07/14/2024 - 2am, EDT","42 Albany Avenue Brooklyn, NY 11213 United States",,,https://storage.googleapis.com/boroom.appspot.com/events/3ca2319f7472b36b575246a44a049af6.png
